{
  "version":"0.3","profile":"song-aesthetic","title":"Transformer 如何理解一句话","audience":"对机器学习有基础兴趣的学习者","learning_objective":"在约 45 秒内建立一个可迁移的心智模型：位置如何进入表示，自注意力如何聚合上下文，多头注意力与前馈子层如何组成 Transformer block。",
  "chapters":[
    {"id":"representation","title":"一、先把词变成可计算的表示","scenes":[{"id":"tokens-to-vectors","title":"句子先变成一组向量","summary":"Transformer 不直接处理“词义”，而是处理 token 的数值表示。输入 embedding 提供内容表示，位置信息让模型知道顺序。","kind":"flow","duration":6,"visual_grammar":"process-flow","motion_grammar":"layered-emergence","director":{"focus":"内容表示与位置信息共同形成输入表示","reading_order":["tokens","embedding","position","input vectors"],"transition":"paper-dissolve","stable_frame":0.55,"evidence":"schematic"},"data":{"steps":["tokens","embedding","+ position","input vectors"]},"fallback":"每个 token 先映射为向量，并加入位置信息，形成送入第一层 Transformer 的输入表示。"}]},
    {"id":"attention","title":"二、自注意力决定“该看谁”","scenes":[
      {"id":"qkv","title":"同一个表示会分成 Query、Key、Value","summary":"Q、K、V 都来自当前表示的不同线性投影。Q 与所有 K 做缩放点积并经 softmax 得到权重，再用这些权重聚合 V。","kind":"flow","duration":7,"visual_grammar":"projection-split","motion_grammar":"ink-line-grow","director":{"focus":"一个表示分裂为 Q/K/V，再通过匹配权重重新聚合 V","reading_order":["representation","Q/K/V","scaled dot product","softmax","weighted V"],"transition":"paper-dissolve","stable_frame":0.62,"evidence":"schematic"},"data":{"source":"token representation","branches":[{"label":"Q","role":"what am I looking for?"},{"label":"K","role":"what can match me?"},{"label":"V","role":"what content can I contribute?"}],"operations":["Q·Kᵀ / √dₖ","softmax","Σ α·V"]},"fallback":"Query 与所有 Key 计算缩放点积，经过 softmax 得到权重，再对对应的 Value 做加权求和。"},
      {"id":"attention-weights","title":"线条强弱就是上下文贡献","summary":"这里用示意权重展示一个 token 如何分配注意力。数值不是某个真实模型的测量结果，也没有加入 decoder-only 的 causal mask；目的只是说明加权聚合机制。","kind":"chart","duration":6,"visual_grammar":"attention-map","motion_grammar":"focus-reveal","director":{"focus":"当前 token 对不同位置分配不同权重","reading_order":["focus token","relation lines","weights","target tokens"],"transition":"paper-dissolve","stable_frame":0.64,"evidence":"illustrative"},"data":{"tokens":["我","正在","读","书"],"focus_index":2,"weights":[0.08,0.12,0.18,0.62]},"fallback":"教学示意中，“读”对“书”的权重最大，因此“书”的 Value 对新的上下文表示贡献最大。"},
      {"id":"multi-head","title":"多头注意力是并行的学习视角","summary":"多个 attention head 使用各自学习到的投影，在不同表示子空间中并行计算注意力；结果拼接后再投影。不要给每个 head 强行指定固定的人类语义。","kind":"compare","duration":6,"visual_grammar":"parallel-heads","motion_grammar":"quiet-parallel","director":{"focus":"同一输入并行进入多个独立 head，最后合并","reading_order":["shared input","parallel heads","concat","projection"],"transition":"paper-dissolve","stable_frame":0.62,"evidence":"schematic"},"data":{"heads":["Head 1","Head 2","Head 3","Head 4"]},"fallback":"多头注意力并行计算多个独立的注意力表示，再把结果合并；不同 head 的功能由训练学得，不保证具有固定的人类可解释角色。"}
    ]},
    {"id":"block","title":"三、Attention 只是一个子层","scenes":[{"id":"block-flow","title":"一个 Transformer block 还包含前馈网络","summary":"在经典结构中，注意力子层和 position-wise feed-forward 子层都带有残差连接与归一化。堆叠这些 block，表示会逐层被重新编码。","kind":"flow","duration":7,"visual_grammar":"layer-stack","motion_grammar":"layered-emergence","director":{"focus":"一个 block 的内部顺序，以及 block 的重复堆叠","reading_order":["self-attention","residual + norm","feed-forward","residual + norm","repeat"],"transition":"paper-dissolve","stable_frame":0.68,"evidence":"schematic"},"data":{"steps":["self-attention","residual + norm","feed-forward","residual + norm"],"repeat":"× N layers"},"fallback":"注意力输出经过残差连接与归一化，再进入逐位置前馈网络，之后再次经过残差连接与归一化，形成下一层输入；这种 block 会重复堆叠。"}]},
    {"id":"architecture","title":"四、原版 Transformer 与现代 LLM 不完全相同","scenes":[
      {"id":"architecture-variants","title":"核心机制延续，整体架构可以不同","summary":"2017 年原论文用于机器翻译，采用 encoder-decoder Transformer。许多现代生成式大语言模型采用 decoder-only 变体，但仍以注意力和前馈子层为核心构件。","kind":"compare","duration":6,"visual_grammar":"comparison","motion_grammar":"focus-reveal","director":{"focus":"不要把所有 Transformer 都画成同一种总体结构","reading_order":["2017 canonical","modern variants","shared mechanism"],"transition":"paper-dissolve","stable_frame":0.55,"evidence":"literal"},"data":{"left":{"label":"2017 canonical Transformer","value":"Encoder + Decoder"},"right":{"label":"Many modern LLMs","value":"Decoder-only variant"}},"fallback":"原版 Transformer 是编码器-解码器结构；许多现代大语言模型采用仅解码器变体，因此不能把所有 Transformer 都画成完全相同的整体架构。"},
      {"id":"mental-model","title":"最后只记住这一条主线","summary":"位置进入表示；每个 token 通过注意力读取上下文；多个 head 并行学习关系；前馈子层继续变换表示；多个 block 反复堆叠。","kind":"text","duration":5,"visual_grammar":"focus-reveal","motion_grammar":"paper-dissolve","director":{"focus":"把所有局部机制压缩成一个可迁移心智模型","reading_order":["position","attention","multi-head","feed-forward","stack"],"transition":"paper-dissolve","stable_frame":0.56,"evidence":"schematic"},"fallback":"Transformer 的核心心智模型：带位置信息的 token 表示，通过自注意力聚合上下文，再经过前馈变换，并在多层中重复。"}
    ]}
  ]
}
